{
  "key": "species-rodian",
  "assetGroup": "species",
  "assetKey": "rodian",
  "status": "inherited-unattributed",
  "provenance": "Inherited from the original sw5e.com art pool. That site credited its artists as a single alphabetical list and never recorded which artist made which image, so the author of this particular picture is not known from the archive.",
  "basis": "unrecorded"
}
